### ISSUE TITLE
Duplicated authorization header

### ISSUE THREAD

**Issue by SimoneLazzaris** [codenotary/immudb#1147]
**What happened**
After calling `UseDatabase` API, following HTTP requests have a duplicated `authorization` header, one with in the form
`authorization: Bearer <token>`, one in the form `authorization: <token>` (that is, without the `Bearer` word in it)

This confuses proxies like envoy, which just forward one of them, breaking authentication.

**What you expected to happen**

Just one authorization header should be present

**How to reproduce it (as minimally and precisely as possible)**

**Environment**
```shell
# run "immu* version" and copy/paste the output here
immudb 1.2.2
Commit  : d9620608863d820352db9bf5aa7abd5ca5989ee4
```

**Additional info (any other context about the problem)**
This is a packet captured with wireshark:
```
Frame 40: 452 bytes on wire (3616 bits), 452 bytes captured (3616 bits)
Ethernet II, Src: 00:00:00_00:00:00 (00:00:00:00:00:00), Dst: 00:00:00_00:00:00 (00:00:00:00:00:00)
Internet Protocol Version 4, Src: 127.0.0.1, Dst: 127.0.0.2
Transmission Control Protocol, Src Port: 47016, Dst Port: 8322, Seq: 342, Ack: 714, Len: 386
HyperText Transfer Protocol 2
    Stream: HEADERS, Stream ID: 7, Length 352, POST /immudb.schema.ImmuService/UseDatabase
        Length: 352
        Type: HEADERS (1)
        Flags: 0x04, End Headers
        0... .... .... .... .... .... .... .... = Reserved: 0x0
        .000 0000 0000 0000 0000 0000 0000 0111 = Stream Identifier: 7
        [Pad Length: 0]
        Header Block Fragment: 8386459b60d4d36c91ae824e5a46be4a69b7716cee62158e082df1a4718d05c4c3c2c157…
        [Header Length: 638]
        [Header Count: 9]
        Header: :method: POST
        Header: :scheme: http
        Header: :path: /immudb.schema.ImmuService/UseDatabase
        Header: :authority: 127.0.0.2:8322
        Header: content-type: application/grpc
        Header: user-agent: grpc-go/1.39.0
        Header: te: trailers
        Header: authorization: Bearer v2.public.eyJkYXRhYmFzZSI6IjAiLCJleHAiOiIyMDIyLTAzLTE2VDE3OjMxOjQ1KzAxOjAwIiwic3ViIjoiaW1tdWRiIn0s1BKy5WFU8dTkIG8oFpnSL1wRFjPnX__DFyxr9ErJ5l8f3ELA3Fh_AMjZigXVm0DzLS4McciO3RaFohErcfwP.aW1tdWRi
        Header: authorization: v2.public.eyJkYXRhYmFzZSI6IjAiLCJleHAiOiIyMDIyLTAzLTE2VDE3OjMxOjQ1KzAxOjAwIiwic3ViIjoiaW1tdWRiIn0s1BKy5WFU8dTkIG8oFpnSL1wRFjPnX__DFyxr9ErJ5l8f3ELA3Fh_AMjZigXVm0DzLS4McciO3RaFohErcfwP.aW1tdWRi
    Stream: DATA, Stream ID: 7, Length 16
GRPC Message: /immudb.schema.ImmuService/UseDatabase, Request
    Compressed Flag: Not Compressed (0)
    Message Length: 11
    Message Data: 11 bytes
Protocol Buffers: /immudb.schema.ImmuService/UseDatabase,request
```
